<?xml version="1.0" encoding="UTF-8"?>

<!-- W3C Schema generated by XMLSpy v2017 sp2 (http://www.altova.com) -->
<xs:schema xmlns:xs="http://www.w3.org/2001/XMLSchema">
	<xs:element name="Email" type="xs:string"/>
	<xs:element name="Phone" type="xs:int"/>
	<xs:element name="People">
		<xs:complexType>
			<xs:sequence>
				<xs:element ref="Person" maxOccurs="unbounded"/>
			</xs:sequence>
		</xs:complexType>
	</xs:element>
	<xs:element name="Person">
		<xs:complexType>
			<xs:sequence>
				<xs:element ref="FirstName"/>
				<xs:element ref="LastName"/>
				<xs:element ref="Email"/>
				<xs:element ref="Phone"/>
			</xs:sequence>
		</xs:complexType>
	</xs:element>
	<xs:element name="LastName" type="xs:string"/>
	<xs:element name="FirstName" type="xs:string"/>
</xs:schema>
